{"$schema":"https://json-schema.org/draft/2020-12/schema","title":"Detector Registry Entry v1","type":"object","additionalProperties":false,"required":["detector_id","name","description","lifecycle_vocabulary","roles","derives_from","native_scales","known_surfaces","semantic_status","availability_semantics","domain"],"properties":{"detector_id":{"type":"string"},"name":{"type":"string"},"description":{"type":"string"},"lifecycle_vocabulary":{"type":"array","items":{"type":"string"}},"roles":{"type":"array","items":{"type":"string"}},"derives_from":{"type":"array","items":{"type":"string"}},"native_scales":{},"known_surfaces":{"type":"array","items":{"type":"string"}},"semantic_status":{"enum":["AUTHORITATIVE","PROVISIONAL","UNRESOLVED"]},"availability_semantics":{"type":"string"},"domain":{"type":"string"}}}
