[
  {"detector_id":"swings","name":"swings","description":"Authoritative bar surface; semantics unresolved.","lifecycle_vocabulary":[],"roles":[],"derives_from":[],"native_scales":{"kind":"explicit","scales":["15s","30s","1m","5m","15m","1h","4h"]},"known_surfaces":["bar"],"semantic_status":"UNRESOLVED","availability_semantics":"UNRESOLVED; authoritative manifest surface only.","domain":"bar"},
  {"detector_id":"raw3","name":"raw3","description":"Authoritative bar surface; semantics unresolved.","lifecycle_vocabulary":[],"roles":[],"derives_from":[],"native_scales":{"kind":"explicit","scales":["15s","30s","1m","5m","15m","1h","4h"]},"known_surfaces":["bar"],"semantic_status":"UNRESOLVED","availability_semantics":"UNRESOLVED; authoritative manifest surface only.","domain":"bar"},
  {"detector_id":"range","name":"range","description":"Authoritative bar surface; semantics unresolved.","lifecycle_vocabulary":[],"roles":[],"derives_from":[],"native_scales":{"kind":"explicit","scales":["15s","30s","1m","5m","15m","1h","4h"]},"known_surfaces":["bar"],"semantic_status":"UNRESOLVED","availability_semantics":"UNRESOLVED; authoritative manifest surface only.","domain":"bar"},
  {"detector_id":"fvg","name":"fvg","description":"Authoritative bar surface; semantics unresolved.","lifecycle_vocabulary":[],"roles":[],"derives_from":[],"native_scales":{"kind":"explicit","scales":["15s","30s","1m","5m","15m","1h","4h"]},"known_surfaces":["bar"],"semantic_status":"UNRESOLVED","availability_semantics":"UNRESOLVED; authoritative manifest surface only.","domain":"bar"},
  {"detector_id":"bos_choch","name":"bos_choch","description":"Authoritative bar surface; semantics unresolved.","lifecycle_vocabulary":[],"roles":[],"derives_from":[],"native_scales":{"kind":"explicit","scales":["15s","30s","1m","5m","15m","1h","4h"]},"known_surfaces":["bar"],"semantic_status":"UNRESOLVED","availability_semantics":"UNRESOLVED; authoritative manifest surface only.","domain":"bar"},
  {"detector_id":"order_blocks","name":"order_blocks","description":"Authoritative bar surface; semantics unresolved.","lifecycle_vocabulary":[],"roles":[],"derives_from":[],"native_scales":{"kind":"explicit","scales":["15s","30s","1m","5m","15m","1h","4h"]},"known_surfaces":["bar"],"semantic_status":"UNRESOLVED","availability_semantics":"UNRESOLVED; authoritative manifest surface only.","domain":"bar"},
  {"detector_id":"local_structure","name":"local_structure","description":"Authoritative bar surface; semantics unresolved.","lifecycle_vocabulary":[],"roles":[],"derives_from":[],"native_scales":{"kind":"explicit","scales":["15s","30s","1m","5m","15m","1h","4h"]},"known_surfaces":["bar"],"semantic_status":"UNRESOLVED","availability_semantics":"UNRESOLVED; authoritative manifest surface only.","domain":"bar"},
  {"detector_id":"volume_by_time","name":"volume_by_time","description":"Authoritative bar surface; semantics unresolved.","lifecycle_vocabulary":[],"roles":[],"derives_from":[],"native_scales":{"kind":"explicit","scales":["15s","30s","1m","5m","15m","1h","4h"]},"known_surfaces":["bar"],"semantic_status":"UNRESOLVED","availability_semantics":"UNRESOLVED; authoritative manifest surface only.","domain":"bar"},
  {"detector_id":"structural_liquidity","name":"structural_liquidity","description":"Authoritative bar surface; semantics unresolved.","lifecycle_vocabulary":[],"roles":[],"derives_from":[],"native_scales":{"kind":"explicit","scales":["15s","30s","1m","5m","15m","1h","4h"]},"known_surfaces":["bar"],"semantic_status":"UNRESOLVED","availability_semantics":"UNRESOLVED; authoritative manifest surface only.","domain":"bar"},
  {"detector_id":"dealing_range","name":"dealing_range","description":"Authoritative bar surface; semantics unresolved.","lifecycle_vocabulary":[],"roles":[],"derives_from":[],"native_scales":{"kind":"explicit","scales":["15s","30s","1m","5m","15m","1h","4h"]},"known_surfaces":["bar"],"semantic_status":"UNRESOLVED","availability_semantics":"UNRESOLVED; authoritative manifest surface only.","domain":"bar"},
  {"detector_id":"micro_liquidity","name":"micro_liquidity","description":"Authoritative bar surface; semantics unresolved.","lifecycle_vocabulary":[],"roles":[],"derives_from":[],"native_scales":{"kind":"explicit","scales":["15s","30s","1m","5m","15m","1h","4h"]},"known_surfaces":["bar"],"semantic_status":"UNRESOLVED","availability_semantics":"UNRESOLVED; authoritative manifest surface only.","domain":"bar"},
  {"detector_id":"micro_liquidity_context","name":"micro_liquidity_context","description":"Authoritative bar surface; semantics unresolved.","lifecycle_vocabulary":[],"roles":[],"derives_from":[],"native_scales":{"kind":"explicit","scales":["15s","30s","1m","5m","15m","1h","4h"]},"known_surfaces":["bar"],"semantic_status":"UNRESOLVED","availability_semantics":"UNRESOLVED; authoritative manifest surface only.","domain":"bar"},
  {"detector_id":"volume_trend","name":"volume_trend","description":"Authoritative bar surface; semantics unresolved.","lifecycle_vocabulary":[],"roles":[],"derives_from":[],"native_scales":{"kind":"explicit","scales":["15s","30s","1m","5m","15m","1h","4h"]},"known_surfaces":["bar"],"semantic_status":"UNRESOLVED","availability_semantics":"UNRESOLVED; authoritative manifest surface only.","domain":"bar"},
  {"detector_id":"auction_context","name":"auction_context","description":"Authoritative bar surface; semantics unresolved.","lifecycle_vocabulary":[],"roles":[],"derives_from":[],"native_scales":{"kind":"explicit","scales":["15s","30s","1m","5m","15m","1h","4h"]},"known_surfaces":["bar"],"semantic_status":"UNRESOLVED","availability_semantics":"UNRESOLVED; authoritative manifest surface only.","domain":"bar"},
  {"detector_id":"time_context","name":"time_context","description":"Authoritative bar surface; semantics unresolved.","lifecycle_vocabulary":[],"roles":[],"derives_from":[],"native_scales":{"kind":"explicit","scales":["15s","30s","1m","5m","15m","1h","4h"]},"known_surfaces":["bar"],"semantic_status":"UNRESOLVED","availability_semantics":"UNRESOLVED; authoritative manifest surface only.","domain":"bar"},
  {"detector_id":"vwma_atr","name":"vwma_atr","description":"Authoritative bar surface; semantics unresolved.","lifecycle_vocabulary":[],"roles":[],"derives_from":[],"native_scales":{"kind":"explicit","scales":["15s","30s","1m","5m","15m","1h","4h"]},"known_surfaces":["bar"],"semantic_status":"UNRESOLVED","availability_semantics":"UNRESOLVED; authoritative manifest surface only.","domain":"bar"},
  {"detector_id":"drift_burst","name":"drift_burst","description":"Authoritative tick surface; semantics unresolved.","lifecycle_vocabulary":[],"roles":[],"derives_from":[],"native_scales":{"kind":"tick"},"known_surfaces":["tick"],"semantic_status":"UNRESOLVED","availability_semantics":"UNRESOLVED; authoritative manifest surface only.","domain":"tick"},
  {"detector_id":"spread_state","name":"spread_state","description":"Authoritative tick surface; semantics unresolved.","lifecycle_vocabulary":[],"roles":[],"derives_from":[],"native_scales":{"kind":"tick"},"known_surfaces":["tick"],"semantic_status":"UNRESOLVED","availability_semantics":"UNRESOLVED; authoritative manifest surface only.","domain":"tick"},
  {"detector_id":"quote_dynamics","name":"quote_dynamics","description":"Authoritative tick surface; semantics unresolved.","lifecycle_vocabulary":[],"roles":[],"derives_from":[],"native_scales":{"kind":"tick"},"known_surfaces":["tick"],"semantic_status":"UNRESOLVED","availability_semantics":"UNRESOLVED; authoritative manifest surface only.","domain":"tick"},
  {"detector_id":"quote_arrival","name":"quote_arrival","description":"Authoritative tick surface; semantics unresolved.","lifecycle_vocabulary":[],"roles":[],"derives_from":[],"native_scales":{"kind":"tick"},"known_surfaces":["tick"],"semantic_status":"UNRESOLVED","availability_semantics":"UNRESOLVED; authoritative manifest surface only.","domain":"tick"},
  {"detector_id":"micro_volatility","name":"micro_volatility","description":"Authoritative tick surface; semantics unresolved.","lifecycle_vocabulary":[],"roles":[],"derives_from":[],"native_scales":{"kind":"tick"},"known_surfaces":["tick"],"semantic_status":"UNRESOLVED","availability_semantics":"UNRESOLVED; authoritative manifest surface only.","domain":"tick"},
  {"detector_id":"feed_health","name":"feed_health","description":"Authoritative tick surface; semantics unresolved.","lifecycle_vocabulary":[],"roles":[],"derives_from":[],"native_scales":{"kind":"tick"},"known_surfaces":["tick"],"semantic_status":"UNRESOLVED","availability_semantics":"UNRESOLVED; authoritative manifest surface only.","domain":"tick"},
  {"detector_id":"quote_pressure","name":"quote_pressure","description":"Authoritative tick surface; semantics unresolved.","lifecycle_vocabulary":[],"roles":[],"derives_from":[],"native_scales":{"kind":"tick"},"known_surfaces":["tick"],"semantic_status":"UNRESOLVED","availability_semantics":"UNRESOLVED; authoritative manifest surface only.","domain":"tick"}
]
